,PassengerId,Survived,Pclass,Name,Sex,Age,SibSp,Parch,Ticket,Fare,Cabin,Embarked
582,583,0,2,"Downton, Mr. William James",male,54.0,0,0,28403,26.0,,S
559,560,1,3,"de Messemaeker, Mrs. Guillaume Joseph (Emma)",female,36.0,1,0,345572,17.4,,S
221,222,0,2,"Bracken, Mr. James H",male,27.0,0,0,220367,13.0,,S
71,72,0,3,"Goodwin, Miss. Lillian Amy",female,16.0,5,2,CA 2144,46.9,,S
704,705,0,3,"Hansen, Mr. Henrik Juul",male,26.0,1,0,350025,7.8542,,S
0,1,0,3,"Braund, Mr. Owen Harris",male,22.0,1,0,A/5 21171,7.25,,S
754,755,1,2,"Herman, Mrs. Samuel (Jane Laver)",female,48.0,1,2,220845,65.0,,S
717,718,1,2,"Troutt, Miss. Edwina Celia ""Winnie""",female,27.0,0,0,34218,10.5,E101,S
549,550,1,2,"Davies, Master. John Morgan Jr",male,8.0,1,1,C.A. 33112,36.75,,S
771,772,0,3,"Jensen, Mr. Niels Peder",male,48.0,0,0,350047,7.8542,,S
815,816,0,1,"Fry, Mr. Richard",male,,0,0,112058,0.0,B102,S
272,273,1,2,"Mellinger, Mrs. (Elizabeth Anne Maidment)",female,41.0,0,1,250644,19.5,,S
634,635,0,3,"Skoog, Miss. Mabel",female,9.0,3,2,347088,27.9,,S
745,746,0,1,"Crosby, Capt. Edward Gifford",male,70.0,1,1,WE/P 5735,71.0,B22,S
203,204,0,3,"Youseff, Mr. Gerious",male,45.5,0,0,2628,7.225,,C
174,175,0,1,"Smith, Mr. James Clinch",male,56.0,0,0,17764,30.6958,A7,C
497,498,0,3,"Shellard, Mr. Frederick William",male,,0,0,C.A. 6212,15.1,,S
770,771,0,3,"Lievens, Mr. Rene Aime",male,24.0,0,0,345781,9.5,,S
450,451,0,2,"West, Mr. Edwy Arthur",male,36.0,1,2,C.A. 34651,27.75,,S
458,459,1,2,"Toomey, Miss. Ellen",female,50.0,0,0,F.C.C. 13531,10.5,,S
118,119,0,1,"Baxter, Mr. Quigg Edmond",male,24.0,0,1,PC 17558,247.5208,B58 B60,C
713,714,0,3,"Larsson, Mr. August Viktor",male,29.0,0,0,7545,9.4833,,S
641,642,1,1,"Sagesser, Mlle. Emma",female,24.0,0,0,PC 17477,69.3,B35,C
327,328,1,2,"Ball, Mrs. (Ada E Hall)",female,36.0,0,0,28551,13.0,D,S
353,354,0,3,"Arnold-Franchi, Mr. Josef",male,25.0,1,0,349237,17.8,,S
463,464,0,2,"Milling, Mr. Jacob Christian",male,48.0,0,0,234360,13.0,,S
452,453,0,1,"Foreman, Mr. Benjamin Laventall",male,30.0,0,0,113051,27.75,C111,C
443,444,1,2,"Reynaldo, Ms. Encarnacion",female,28.0,0,0,230434,13.0,,S
843,844,0,3,"Lemberopolous, Mr. Peter L",male,34.5,0,0,2683,6.4375,,C
264,265,0,3,"Henry, Miss. Delia",female,,0,0,382649,7.75,,Q
175,176,0,3,"Klasen, Mr. Klas Albin",male,18.0,1,1,350404,7.8542,,S
479,480,1,3,"Hirvonen, Miss. Hildur E",female,2.0,0,1,3101298,12.2875,,S
44,45,1,3,"Devaney, Miss. Margaret Delia",female,19.0,0,0,330958,7.8792,,Q
543,544,1,2,"Beane, Mr. Edward",male,32.0,1,0,2908,26.0,,S
383,384,1,1,"Holverson, Mrs. Alexander Oskar (Mary Aline Towner)",female,35.0,1,0,113789,52.0,,S
747,748,1,2,"Sinkkonen, Miss. Anna",female,30.0,0,0,250648,13.0,,S
194,195,1,1,"Brown, Mrs. James Joseph (Margaret Tobin)",female,44.0,0,0,PC 17610,27.7208,B4,C
126,127,0,3,"McMahon, Mr. Martin",male,,0,0,370372,7.75,,Q
772,773,0,2,"Mack, Mrs. (Mary)",female,57.0,0,0,S.O./P.P. 3,10.5,E77,S
220,221,1,3,"Sunderland, Mr. Victor Francis",male,16.0,0,0,SOTON/OQ 392089,8.05,,S
347,348,1,3,"Davison, Mrs. Thomas Henry (Mary E Finck)",female,,1,0,386525,16.1,,S
652,653,0,3,"Kalvik, Mr. Johannes Halvorsen",male,21.0,0,0,8475,8.4333,,S
93,94,0,3,"Dean, Mr. Bertram Frank",male,26.0,1,2,C.A. 2315,20.575,,S
142,143,1,3,"Hakkarainen, Mrs. Pekka Pietari (Elin Matilda Dolck)",female,24.0,1,0,STON/O2. 3101279,15.85,,S
183,184,1,2,"Becker, Master. Richard F",male,1.0,2,1,230136,39.0,F4,S
805,806,0,3,"Johansson, Mr. Karl Johan",male,31.0,0,0,347063,7.775,,S
764,765,0,3,"Eklund, Mr. Hans Linus",male,16.0,0,0,347074,7.775,,S
485,486,0,3,"Lefebre, Miss. Jeannie",female,,3,1,4133,25.4667,,S
236,237,0,2,"Hold, Mr. Stephen",male,44.0,1,0,26707,26.0,,S
478,479,0,3,"Karlsson, Mr. Nils August",male,22.0,0,0,350060,7.5208,,S
45,46,0,3,"Rogers, Mr. William John",male,,0,0,S.C./A.4. 23567,8.05,,S
538,539,0,3,"Risien, Mr. Samuel Beard",male,,0,0,364498,14.5,,S
867,868,0,1,"Roebling, Mr. Washington Augustus II",male,31.0,0,0,PC 17590,50.4958,A24,S
606,607,0,3,"Karaic, Mr. Milan",male,30.0,0,0,349246,7.8958,,S
820,821,1,1,"Hays, Mrs. Charles Melville (Clara Jennings Gregg)",female,52.0,1,1,12749,93.5,B69,S
1,2,1,1,"Cumings, Mrs. John Bradley (Florence Briggs Thayer)",female,38.0,1,0,PC 17599,71.2833,C85,C
274,275,1,3,"Healy, Miss. Hanora ""Nora""",female,,0,0,370375,7.75,,Q
793,794,0,1,"Hoyt, Mr. William Fisher",male,,0,0,PC 17600,30.6958,,C
162,163,0,3,"Bengtsson, Mr. John Viktor",male,26.0,0,0,347068,7.775,,S
692,693,1,3,"Lam, Mr. Ali",male,,0,0,1601,56.4958,,S
231,232,0,3,"Larsson, Mr. Bengt Edvin",male,29.0,0,0,347067,7.775,,S
411,412,0,3,"Hart, Mr. Henry",male,,0,0,394140,6.8583,,Q
122,123,0,2,"Nasser, Mr. Nicholas",male,32.5,1,0,237736,30.0708,,C
309,310,1,1,"Francatelli, Miss. Laura Mabel",female,30.0,0,0,PC 17485,56.9292,E36,C
282,283,0,3,"de Pelsmaeker, Mr. Alfons",male,16.0,0,0,345778,9.5,,S
690,691,1,1,"Dick, Mr. Albert Adrian",male,31.0,1,0,17474,57.0,B20,S
405,406,0,2,"Gale, Mr. Shadrach",male,34.0,1,0,28664,21.0,,S
752,753,0,3,"Vande Velde, Mr. Johannes Joseph",male,33.0,0,0,345780,9.5,,S
431,432,1,3,"Thorneycroft, Mrs. Percival (Florence Kate White)",female,,1,0,376564,16.1,,S
659,660,0,1,"Newell, Mr. Arthur Webster",male,58.0,0,2,35273,113.275,D48,C
782,783,0,1,"Long, Mr. Milton Clyde",male,29.0,0,0,113501,30.0,D6,S
